{
  "schema": "cxf-library/routine-class-manifest/v1",
  "id": "G36-05-05-COOLING-AIRFLOW-SETPOINT",
  "revision": 1,
  "section": "5.5",
  "source": {
    "kind": "independent",
    "paths": [
      "tools/authoring/g36_reference.py",
      "routines/g36/terminal-units/cooling-only/airflow-setpoint/source.md"
    ]
  },
  "artifacts": {
    "interface": "routines/g36/terminal-units/cooling-only/airflow-setpoint/interface.json",
    "specialization_schema": "routines/g36/terminal-units/cooling-only/airflow-setpoint/specialization.schema.json",
    "specialization_config": "routines/g36/terminal-units/cooling-only/airflow-setpoint/specialization.json"
  }
}
