{
  "schema": "cxf-library/routine-class-manifest/v1",
  "id": "G36-05-16-SYNTHETIC-SCHEMA-TEST",
  "revision": 1,
  "section": "5.16",
  "source": {
    "kind": "upstream",
    "snapshot": "release",
    "revision": "1111111111111111111111111111111111111111",
    "modelica_class": "Buildings.Controls.OBC.ASHRAE.G36.TestOnly.SchemaFixture",
    "files": [
      {
        "path": "Buildings/Controls/OBC/ASHRAE/G36/TestOnly/SchemaFixture.mo",
        "git_blob_sha1": "sha1:2222222222222222222222222222222222222222"
      }
    ]
  },
  "artifacts": {
    "interface": "test-only/g36-05-16-synthetic-schema-test/interface.json",
    "specialization_schema": "test-only/g36-05-16-synthetic-schema-test/specialization.schema.json",
    "specialization_config": "test-only/g36-05-16-synthetic-schema-test/specialization.json"
  }
}
