{
  "schema": "cxf-library/routine-class-manifest/v1",
  "id": "G36-05-03-ZONE-STATE",
  "revision": 1,
  "section": "5.3",
  "source": {
    "kind": "independent",
    "paths": [
      "tools/authoring/g36_reference.py",
      "routines/g36/zones/thermal/zone-state/source.md"
    ]
  },
  "artifacts": {
    "interface": "routines/g36/zones/thermal/zone-state/interface.json",
    "specialization_schema": "routines/g36/zones/thermal/zone-state/specialization.schema.json",
    "specialization_config": "routines/g36/zones/thermal/zone-state/specialization.json"
  }
}
